Una stringa che imposta una selezione esplicita in primavera CGLib,1,3,@EnableAspectJAutoProxy,@EnableAspectJAutoProxy(),@EnableAspectJAutoProxy(proxyTargetClass=true),@EnableAspectJAutoProxy(proxyTargetClass=false)
Quale funzionalità AOP viene utilizzata in Spring, 1.2, AspectForJ, AspectJ, AspectCGLib, Aspect
Cosa viene selezionato in Spring per il funzionamento di AOP se l'oggetto non ha un'interfaccia, 1, 1, CGLib, JDK
Che cos'è waving in Spring AOP, 1.2, modifica della struttura della classe e / o della gerarchia di stratificazione per aggiungere funzionalità di aspetto al codice estraneo, collegamento di oggetti agli aspetti corrispondenti, codice chiamato dal punto di connessione
Che cosa significa i18n., 1, 1, internazionalizzazione, localizzazione
Selezionare tutti i principi OOP inclusi in SOLID-5, 5,1,2,3,8,9, SRP, DIP, LSP, DDD, DRY, KISS, YAGNI, OCP, ISP
Quale principio OOP SOLID-5 corrisponde al testo: le entità devono essere aperte per l'espansione e chiuse per le modifiche, 1,8, SRP, DIP, LSP, DDD, DRY, KISS, YAGNI, OCP, ISP
Scegliere il principio di progettazione del software in cui si deve rinunciare alla funzionalità ridondante, 1,3, DRY, KISS, YAGNI
Quale Annotazione SpringBoot è stanca di implementare il gestore di richieste REST, 1, 1,@Controller,@Service,@Repository,@Component
In Spring con la libreria lombook è necessario specificare un'Annotazione ... per non scrivere un costruttore per la configurazione automatica o @Autowired, 1, 1,@RequiredArgsConstructors, @Data, @PropertySource, @Conditional